<?xml version="1.0" encoding="UTF-8"?>

<!--
  XWork Validators DTD.
  Used the following DOCTYPE.
  
  <!DOCTYPE validators PUBLIC 
  		"-//Apache Struts//XWork Validator 1.0//EN"
  		"http://struts.apache.org/dtds/xwork-validator-1.0.dtd">
-->


<!ELEMENT validators (field*,validator*)>

<!ELEMENT field (field-validator+)>
<!ATTLIST field
	name CDATA #REQUIRED
>

<!ELEMENT field-validator (param*, message)>
<!ATTLIST field-validator
	type CDATA #REQUIRED
>

<!ELEMENT validator (param*, message)>
<!ATTLIST validator
	type CDATA #REQUIRED
>

<!ELEMENT param (#PCDATA)>
<!ATTLIST param
    name CDATA #REQUIRED
>

<!ELEMENT message (#PCDATA)>
<!ATTLIST message
    key CDATA #IMPLIED
>


