<?xml version="1.0" encoding="UTF-8"?>
<!--
/*
 * Licensed to the Apache Software Foundation (ASF) under one
 * or more contributor license agreements.  See the NOTICE file
 * distributed with this work for additional information
 * regarding copyright ownership.  The ASF licenses this file
 * to you under the Apache License, Version 2.0 (the
 * "License"); you may not use this file except in compliance
 * with the License.  You may obtain a copy of the License at
 *
 *  http://www.apache.org/licenses/LICENSE-2.0
 *
 * Unless required by applicable law or agreed to in writing,
 * software distributed under the License is distributed on an
 * "AS IS" BASIS, WITHOUT WARRANTIES OR CONDITIONS OF ANY
 * KIND, either express or implied.  See the License for the
 * specific language governing permissions and limitations
 * under the License.
 */
-->
<!DOCTYPE validators PUBLIC "-//Apache Struts//XWork Validator 1.0//EN" "http://struts.apache.org/dtds/xwork-validator-1.0.dtd">
<validators>
    <field name="horse">
        <field-validator type="requiredstring">
            <param name="trim">false</param>
            <message>noTrim</message>
        </field-validator>
        <field-validator type="requiredstring">
            <param name="trim">true</param>
            <message>trim</message>
        </field-validator>
    </field>

    <field name="cow">
        <field-validator type="stringlength">
            <param name="trim">false</param>
            <param name="minLength">5</param>
            <message>noTrim-min5</message>
        </field-validator>
        <field-validator type="stringlength">
            <param name="trim">false</param>
            <param name="minLength">5</param>
            <param name="maxLength">10</param>
            <message>noTrim-min5-max10</message>
        </field-validator>
        <field-validator type="stringlength">
            <param name="trim">false</param>
            <param name="maxLength">10</param>
            <message>noTrim-max10</message>
        </field-validator>
    </field>

    <field name="donkey">
        <field-validator type="stringlength">
            <param name="trim">true</param>
            <param name="minLength">5</param>
            <message>trim-min5</message>
        </field-validator>
        <field-validator type="stringlength">
            <param name="trim">true</param>
            <param name="minLength">5</param>
            <param name="maxLength">10</param>
            <message>trim-min5-max10</message>
        </field-validator>
        <field-validator type="stringlength">
            <param name="trim">true</param>
            <param name="maxLength">10</param>
            <message>trim-max10</message>
        </field-validator>
    </field>

</validators>
