<!DOCTYPE validators PUBLIC "-//Apache Struts//XWork Validator 1.0//EN" "http://struts.apache.org/dtds/xwork-validator-1.0.dtd">
<validators>
    <field name="birth">
        <field-validator type="date">
            <param name="min">01/01/1970</param>
            <message>You must have been born after 1970.</message>
        </field-validator>
    </field>
    <field name="child">
        <field-validator type="visitor">
            <message>child bean: </message>
        </field-validator>
    </field>
</validators>
